{
  "schemaVersion": 1,
  "id": "shared-guides",
  "kind": "guidance",
  "owner": "shared-harness",
  "visibility": "shared",
  "include": ["*.md"],
  "exclude": [],
  "allowedLinkRoots": [],
  "routeSource": {
    "format": "routed-inventory-v1",
    "groupId": "shared-guides"
  },
  "orphanPolicy": {
    "mode": "forbid"
  },
  "mayContributeAlwaysLoaded": true
}
